{
  "$schema": "https://json-schema.org/draft/2020-12/schema",
  "title": "Desktop environment case",
  "type": "object",
  "additionalProperties": false,
  "properties": {
    "schema_version": {
      "const": 1
    },
    "id": {
      "type": "string",
      "pattern": "^ENV-[0-9]{4}$"
    },
    "title": {
      "type": "string",
      "minLength": 1
    },
    "category": {
      "enum": [
        "runtime",
        "installer",
        "storage",
        "gpu",
        "media",
        "network",
        "security"
      ]
    },
    "platforms": {
      "type": "array",
      "minItems": 1,
      "uniqueItems": true,
      "items": {
        "enum": [
          "windows",
          "macos",
          "linux",
          "unknown"
        ]
      }
    },
    "products": {
      "type": "array",
      "minItems": 1,
      "uniqueItems": true,
      "items": {
        "type": "string",
        "minLength": 1
      }
    },
    "keywords": {
      "type": "array",
      "minItems": 1,
      "uniqueItems": true,
      "items": {
        "type": "string",
        "minLength": 1
      }
    },
    "status": {
      "enum": [
        "reported",
        "confirmed",
        "superseded"
      ]
    },
    "updated_at": {
      "type": "string",
      "format": "date"
    },
    "summary": {
      "type": "string",
      "minLength": 1
    },
    "symptoms": {
      "type": "array",
      "minItems": 1,
      "uniqueItems": true,
      "items": {
        "type": "string",
        "minLength": 1
      }
    },
    "environment": {
      "type": "array",
      "minItems": 1,
      "uniqueItems": true,
      "items": {
        "type": "string",
        "minLength": 1
      }
    },
    "cause": {
      "type": "object",
      "additionalProperties": false,
      "properties": {
        "summary": {
          "type": "string",
          "minLength": 1
        },
        "confidence": {
          "enum": [
            "unknown",
            "suspected",
            "confirmed"
          ]
        },
        "evidence_ids": {
          "type": "array",
          "uniqueItems": true,
          "items": {
            "type": "string",
            "pattern": "^E[0-9]+$"
          }
        }
      },
      "required": [
        "summary",
        "confidence",
        "evidence_ids"
      ]
    },
    "detection": {
      "type": "object",
      "additionalProperties": false,
      "properties": {
        "checks": {
          "type": "array",
          "minItems": 1,
          "uniqueItems": true,
          "items": {
            "type": "string",
            "minLength": 1
          }
        },
        "exclusions": {
          "type": "array",
          "minItems": 1,
          "uniqueItems": true,
          "items": {
            "type": "string",
            "minLength": 1
          }
        }
      },
      "required": [
        "checks",
        "exclusions"
      ]
    },
    "remediations": {
      "type": "array",
      "minItems": 1,
      "items": {
        "type": "object",
        "additionalProperties": false,
        "properties": {
          "kind": {
            "enum": [
              "product_fix",
              "workaround",
              "diagnostic"
            ]
          },
          "description": {
            "type": "string",
            "minLength": 1
          },
          "steps": {
            "type": "array",
            "minItems": 1,
            "uniqueItems": true,
            "items": {
              "type": "string",
              "minLength": 1
            }
          },
          "verification": {
            "type": "array",
            "minItems": 1,
            "uniqueItems": true,
            "items": {
              "type": "string",
              "minLength": 1
            }
          },
          "risks": {
            "type": "array",
            "minItems": 1,
            "uniqueItems": true,
            "items": {
              "type": "string",
              "minLength": 1
            }
          },
          "evidence_ids": {
            "type": "array",
            "uniqueItems": true,
            "items": {
              "type": "string",
              "pattern": "^E[0-9]+$"
            }
          }
        },
        "required": [
          "kind",
          "description",
          "steps",
          "verification",
          "risks",
          "evidence_ids"
        ]
      }
    },
    "evidence": {
      "type": "array",
      "minItems": 1,
      "items": {
        "type": "object",
        "additionalProperties": false,
        "properties": {
          "id": {
            "type": "string",
            "pattern": "^E[0-9]+$"
          },
          "type": {
            "enum": [
              "customer_report",
              "reproduction",
              "source_analysis",
              "ci",
              "vendor_documentation"
            ]
          },
          "summary": {
            "type": "string",
            "minLength": 1
          },
          "scope": {
            "type": "string",
            "minLength": 1
          },
          "observed_at": {
            "type": "string",
            "format": "date"
          },
          "reference": {
            "type": "string",
            "format": "uri",
            "pattern": "^https://"
          }
        },
        "required": [
          "id",
          "type",
          "summary",
          "scope",
          "observed_at"
        ]
      }
    },
    "limitations": {
      "type": "array",
      "minItems": 1,
      "uniqueItems": true,
      "items": {
        "type": "string",
        "minLength": 1
      }
    },
    "reproducer": {
      "type": "object",
      "additionalProperties": false,
      "properties": {
        "path": {
          "type": "string",
          "pattern": "^reproducers/ENV-[0-9]{4}\\.test\\.mjs$"
        },
        "command": {
          "type": "string",
          "minLength": 1
        },
        "scope": {
          "type": "string",
          "minLength": 1
        }
      },
      "required": [
        "path",
        "command",
        "scope"
      ]
    }
  },
  "required": [
    "schema_version",
    "id",
    "title",
    "category",
    "platforms",
    "products",
    "keywords",
    "status",
    "updated_at",
    "summary",
    "symptoms",
    "environment",
    "cause",
    "detection",
    "remediations",
    "evidence",
    "limitations"
  ]
}
