{
  "schema_version": 1,
  "id": "ENV-0048",
  "title": "低帧率视频使用整帧时长容差会放宽输入秒数上限",
  "category": "media",
  "platforms": [
    "windows",
    "macos"
  ],
  "products": [
    "BeefTV"
  ],
  "keywords": [
    "低帧率",
    "fps",
    "时长容差",
    "100ms",
    "输入校验"
  ],
  "status": "confirmed",
  "updated_at": "2026-10-15",
  "summary": "低帧率视频的时长校验可能接受超过预定秒数上限的输入。 案例收录已确认的具体机制；发布与客户恢复另看证据。",
  "symptoms": [
    "低帧率视频的时长校验可能接受超过预定秒数上限的输入。"
  ],
  "environment": [
    "本地深度视频按容器时长校验；低 fps 时一帧可代表很长时间。"
  ],
  "cause": {
    "summary": "按整帧时长放宽容差会随 fps 降低而扩大，和应用约 100ms 的固定容器元数据容差不一致。",
    "confidence": "confirmed",
    "evidence_ids": [
      "E1",
      "E2"
    ]
  },
  "detection": {
    "checks": [
      "同时检查 duration、frames 和 fps，用低帧率边界输入测试超过秒数限制的情况。",
      "核对容器元数据误差与业务允许上限，不能以一帧等于固定短间隔。"
    ],
    "exclusions": [
      "仅当所列环境与检查结果吻合时适用；相同症状仍需排除其他原因。"
    ]
  },
  "remediations": [
    {
      "kind": "product_fix",
      "description": "使用与应用一致的固定时间容差，并拒绝无有效帧率、帧数或时长信息的输入。",
      "steps": [
        "使用与应用一致的固定时间容差，并拒绝无有效帧率、帧数或时长信息的输入。"
      ],
      "verification": [
        "上限附近的正常容器误差可接受，低帧率的明显超长视频仍拒绝。"
      ],
      "risks": [
        "不通过无限放宽容差来消除输入失败，也不要把 CPU 慢推理和输入时间长度混为一谈。"
      ],
      "evidence_ids": [
        "E1",
        "E2"
      ]
    }
  ],
  "evidence": [
    {
      "id": "E1",
      "type": "source_analysis",
      "summary": "历史已合并 PR #44 对机制和处理的记录：按整帧时长放宽容差会随 fps 降低而扩大，和应用约 100ms 的固定容器元数据容差不一致。",
      "scope": "本轮回读合并状态，并核对固定代码/原有验收资料；未重新执行历史验证，不据此认定原客户已恢复。",
      "observed_at": "2026-10-15",
      "reference": "https://github.com/glanderness/BeefTV/pull/44"
    },
    {
      "id": "E2",
      "type": "source_analysis",
      "summary": "固定提交 09e9e549bf3bb9fb9ba7ea12bc5febf342c78ca1：tools/depth-capture/depth_capture/pipeline.py",
      "scope": "固定历史代码或验收资料。复检步骤是未来重放条件，不表示本轮已经在相应系统执行。",
      "observed_at": "2026-10-15",
      "reference": "https://github.com/glanderness/BeefTV/blob/09e9e549bf3bb9fb9ba7ea12bc5febf342c78ca1/tools/depth-capture/depth_capture/pipeline.py"
    }
  ],
  "limitations": [
    "属于已验证输入兼容检查机制，不是声称发生过某个未提供素材的客户故障。",
    "本轮是历史知识补录，没有在客户机器执行修复，也没有重跑历史付费生成、原生安装或平台矩阵。"
  ]
}
