{
  "schema_version": 1,
  "id": "ENV-0032",
  "title": "弱 ETag 或仅 Last-Modified 不足以保证断点字节属于同一对象",
  "category": "network",
  "platforms": [
    "windows",
    "macos",
    "linux"
  ],
  "products": [
    "BeefTV"
  ],
  "keywords": [
    "If-Range",
    "弱ETag",
    "Last-Modified",
    "CDN",
    "数据完整性"
  ],
  "status": "confirmed",
  "updated_at": "2026-10-15",
  "summary": "中断后续传看似完成，但合并了对象两个版本的字节。 案例收录已确认的具体机制；发布与客户恢复另看证据。",
  "symptoms": [
    "中断后续传看似完成，但合并了对象两个版本的字节。"
  ],
  "environment": [
    "源站/CDN 仅提供弱 ETag、日期或没有 validator；本地仍有 partial。"
  ],
  "cause": {
    "summary": "旧 sidecar 没有判定日期足够强的 Date/时钟依据，却复用已有字节，不能证明 Range 与旧前缀同版。",
    "confidence": "confirmed",
    "evidence_ids": [
      "E1",
      "E2"
    ]
  },
  "detection": {
    "checks": [
      "核对 ETag 是否为强验证器，不能只检查非空或资源 URL 相同。",
      "用内容变化、签名 query 刷新、401/403 和断链响应测试保留及重下策略。"
    ],
    "exclusions": [
      "仅当所列环境与检查结果吻合时适用；相同症状仍需排除其他原因。"
    ]
  },
  "remediations": [
    {
      "kind": "product_fix",
      "description": "仅在强 ETag 与来源匹配时续用旧字节；弱/日期/无标识场景请求完整对象，成功拿到响应前保留旧缓存。",
      "steps": [
        "仅在强 ETag 与来源匹配时续用旧字节；弱/日期/无标识场景请求完整对象，成功拿到响应前保留旧缓存。"
      ],
      "verification": [
        "内容变化不能拼接错版字节；强 ETag 仍可续传，失败授权或请求不提前丢失已有进度。"
      ],
      "risks": [
        "完整重下可能增加传输量，但不能为省流量牺牲对象完整性。"
      ],
      "evidence_ids": [
        "E1",
        "E2"
      ]
    }
  ],
  "evidence": [
    {
      "id": "E1",
      "type": "source_analysis",
      "summary": "历史已合并 PR #154 对机制和处理的记录：旧 sidecar 没有判定日期足够强的 Date/时钟依据，却复用已有字节，不能证明 Range 与旧前缀同版。",
      "scope": "本轮回读 PR 合并状态，并核对固定提交所列代码/验收记录；历史验证不记为本轮重跑，不据此认定客户已恢复。",
      "observed_at": "2026-10-15",
      "reference": "https://github.com/glanderness/BeefTV/pull/154"
    },
    {
      "id": "E2",
      "type": "source_analysis",
      "summary": "固定提交 263c91a0aa9cce638b895f3345ebe9abdc7340e4：backend/internal/outbound/resumable_validator_test.go",
      "scope": "固定历史代码或验收资料，用于复查机制及原验证范围。案例中的复检是建议步骤，不代表本轮执行结果。",
      "observed_at": "2026-10-15",
      "reference": "https://github.com/glanderness/BeefTV/blob/263c91a0aa9cce638b895f3345ebe9abdc7340e4/backend/internal/outbound/resumable_validator_test.go"
    }
  ],
  "limitations": [
    "不表示所有 Last-Modified 在协议层都不安全，而是历史实现没有所需强度证明。",
    "本轮是历史知识补录，没有在客户机器执行修复，也没有重跑历史付费生成、原生安装或平台矩阵。"
  ]
}
