{
  "schema_version": 1,
  "id": "ENV-0038",
  "title": "Windows 图片二次处理出现空指针 panic（待复现）",
  "category": "runtime",
  "platforms": [
    "windows"
  ],
  "products": [
    "BeefTV"
  ],
  "keywords": [
    "panic",
    "nil pointer",
    "图片编辑",
    "二次处理"
  ],
  "status": "reported",
  "updated_at": "2026-10-15",
  "summary": "图片二次处理修改表情时出现 invalid memory address or nil pointer dereference。 当前保留为待定位报告。",
  "symptoms": [
    "图片二次处理修改表情时出现 invalid memory address or nil pointer dereference。"
  ],
  "environment": [
    "Issue 报告版本 v1.7.14，后续确认 Windows；模型、渠道协议和完整堆栈缺失。"
  ],
  "cause": {
    "summary": "未确定。没有可定位 panic 堆栈，不能认定为 WebView、模型目录或某个已修复代码路径。",
    "confidence": "unknown",
    "evidence_ids": [
      "E1"
    ]
  },
  "detection": {
    "checks": [
      "取得该次 panic 的脱敏完整堆栈、实际版本及具体编辑步骤。",
      "以合成素材和相同协议进行隔离复现；记录是否发生在发请求前或结果处理后。"
    ],
    "exclusions": [
      "当前证据不足以排除其他根因；不得仅按相似错误提示认定环境问题。"
    ]
  },
  "remediations": [
    {
      "kind": "diagnostic",
      "description": "保留原项目和任务，用诊断信息定位具体空指针入口后再给修复方案。",
      "steps": [
        "取得该次 panic 的脱敏完整堆栈、实际版本及具体编辑步骤。",
        "以合成素材和相同协议进行隔离复现；记录是否发生在发请求前或结果处理后。"
      ],
      "verification": [
        "相同路径稳定复现、修复后不再 panic，且已有项目和任务可读。"
      ],
      "risks": [
        "不要把模糊 panic 与其他相同症状合并；不要求上传密钥、原素材或未脱敏数据库。"
      ],
      "evidence_ids": [
        "E1"
      ]
    }
  ],
  "evidence": [
    {
      "id": "E1",
      "type": "customer_report",
      "summary": "历史 Issue #103 的脱敏症状与排查回复：图片二次处理修改表情时出现 invalid memory address or nil pointer dereference。",
      "scope": "本轮回读公开 Issue 及后续回复；没有取得新的现场日志或复现，不把其他修复等同此报告已解决。",
      "observed_at": "2026-10-15",
      "reference": "https://github.com/glanderness/BeefTV/issues/103"
    }
  ],
  "limitations": [
    "历史 Issue 仍保留为待复现，本轮没有取得新增现场堆栈。",
    "本轮是历史知识补录，没有在客户机器执行修复，也没有重跑历史付费生成、原生安装或平台矩阵。"
  ]
}
