{
  "schema_version": 1,
  "id": "ENV-0016",
  "title": "已发布旧更新器拒绝新增 CLI 或媒体目录",
  "category": "installer",
  "platforms": [
    "windows"
  ],
  "products": [
    "BeefTV"
  ],
  "keywords": [
    "旧更新器",
    "额外文件",
    "agent-host",
    "CLI",
    "布局"
  ],
  "status": "confirmed",
  "updated_at": "2026-10-15",
  "summary": "新包自身有效，但旧客户端报“更新包包含额外文件”或无法更新。 案例收录已确认的具体机制；发布与客户恢复另看证据。",
  "symptoms": [
    "新包自身有效，但旧客户端报“更新包包含额外文件”或无法更新。"
  ],
  "environment": [
    "v1.6.20–v1.6.22 仅接受旧目录；v1.6.23 能接受助手/CLI，但曾拒绝顶层 media-runtime；v1.7.1 另有 CLI 漏装。"
  ],
  "cause": {
    "summary": "接受包布局的是正在运行的旧 EXE，新清单和新包无法先改变旧解析器的允许目录集合。",
    "confidence": "confirmed",
    "evidence_ids": [
      "E1",
      "E2"
    ]
  },
  "detection": {
    "checks": [
      "使用固定哈希的实际已发布旧 EXE 安装最终 ZIP，不能只运行新 helper。",
      "核对旧版本允许目录与新包结构，分别测试升级和启动失败回滚。"
    ],
    "exclusions": [
      "仅当所列环境与检查结果吻合时适用；相同症状仍需排除其他原因。"
    ]
  },
  "remediations": [
    {
      "kind": "product_fix",
      "description": "在已接受的整组目录中放置新资源；无法兼容的旧版提供完整包安装指引，过渡通道必须另外验证后才能承诺。",
      "steps": [
        "在已接受的整组目录中放置新资源；无法兼容的旧版提供完整包安装指引，过渡通道必须另外验证后才能承诺。"
      ],
      "verification": [
        "实际旧 helper 完整替换程序树，旧业务行保留、新后端 ready；坏新程序可完整回滚。"
      ],
      "risks": [
        "不能静默放宽未知 ZIP 条目，也不能以“新包测试通过”宣称所有旧版可自动升级。"
      ],
      "evidence_ids": [
        "E1",
        "E2",
        "E3"
      ]
    }
  ],
  "evidence": [
    {
      "id": "E1",
      "type": "source_analysis",
      "summary": "历史已合并 PR #111 对机制和处理的记录：接受包布局的是正在运行的旧 EXE，新清单和新包无法先改变旧解析器的允许目录集合。",
      "scope": "本轮回读 PR 合并状态，并核对固定提交所列代码/验收记录；历史验证不记为本轮重跑，不据此认定客户已恢复。",
      "observed_at": "2026-10-15",
      "reference": "https://github.com/glanderness/BeefTV/pull/111"
    },
    {
      "id": "E2",
      "type": "source_analysis",
      "summary": "固定提交 bb8d5b83a791a617ca5add41a6874749ed911add：backend/internal/desktopupdate/layout.go",
      "scope": "固定历史代码或验收资料，用于复查机制及原验证范围。案例中的复检是建议步骤，不代表本轮执行结果。",
      "observed_at": "2026-10-15",
      "reference": "https://github.com/glanderness/BeefTV/blob/bb8d5b83a791a617ca5add41a6874749ed911add/backend/internal/desktopupdate/layout.go"
    },
    {
      "id": "E3",
      "type": "source_analysis",
      "summary": "关联 PR #74：test(updater): 建立 Windows 旧包升级与回滚发布门禁",
      "scope": "相关版本或相邻路径证据；请核对差异，不能把同次支持过程的其他修复替代当前根因。",
      "observed_at": "2026-10-15",
      "reference": "https://github.com/glanderness/BeefTV/pull/74"
    }
  ],
  "limitations": [
    "历史过渡通道是提案；旧版本区间和媒体布局版本必须逐项核实，不自动外推。",
    "本轮是历史知识补录，没有在客户机器执行修复，也没有重跑历史付费生成、原生安装或平台矩阵。"
  ]
}
