{
  "schema_version": 1,
  "id": "ENV-0013",
  "title": "PowerShell 5.1 提前关闭输出管道使正常工具自检失败",
  "category": "runtime",
  "platforms": [
    "windows"
  ],
  "products": [
    "Windows PowerShell",
    "BeefTV 深度组件构建"
  ],
  "keywords": [
    "PowerShell 5.1",
    "ffprobe",
    "Select-Object",
    "管道"
  ],
  "status": "confirmed",
  "updated_at": "2026-10-15",
  "summary": "组件构建自检提示 FFmpeg/FFprobe 无法启动，但独立运行版本查询正常。 案例收录已确认的具体机制；发布与客户恢复另看证据。",
  "symptoms": [
    "组件构建自检提示 FFmpeg/FFprobe 无法启动，但独立运行版本查询正常。"
  ],
  "environment": [
    "PowerShell 5.1 中原生命令 -version 输出被接到 Select-Object -First 1。"
  ],
  "cause": {
    "summary": "接收方提前结束读取管道，生产者仍输出，退出状态使脚本误判为启动失败。",
    "confidence": "confirmed",
    "evidence_ids": [
      "E1",
      "E2"
    ]
  },
  "detection": {
    "checks": [
      "先完整捕获 stdout 并读取真实退出码，再显示第一行。",
      "分别检查二进制是否能执行、依赖是否缺失，避免把输出显示问题误当组件损坏。"
    ],
    "exclusions": [
      "仅当所列环境与检查结果吻合时适用；相同症状仍需排除其他原因。"
    ]
  },
  "remediations": [
    {
      "kind": "product_fix",
      "description": "完整读取原生命令输出后验证退出码，再从已捕获文本中取第一行。",
      "steps": [
        "完整读取原生命令输出后验证退出码，再从已捕获文本中取第一行。"
      ],
      "verification": [
        "在 PowerShell 5.1 中正常工具退出成功；真实不存在/无法启动的工具仍失败。"
      ],
      "risks": [
        "不能简单忽略 LASTEXITCODE 或把所有版本自检改为无条件通过。"
      ],
      "evidence_ids": [
        "E1",
        "E2"
      ]
    }
  ],
  "evidence": [
    {
      "id": "E1",
      "type": "source_analysis",
      "summary": "历史已合并 PR #45 对机制和处理的记录：接收方提前结束读取管道，生产者仍输出，退出状态使脚本误判为启动失败。",
      "scope": "本轮回读 PR 合并状态，并核对固定提交所列代码/验收记录；历史验证不记为本轮重跑，不据此认定客户已恢复。",
      "observed_at": "2026-10-15",
      "reference": "https://github.com/glanderness/BeefTV/pull/45"
    },
    {
      "id": "E2",
      "type": "source_analysis",
      "summary": "固定提交 e2ae3d549a699ec2d00680d9c9eda844078a75f5：scripts/test-depth-runtime-windows.ps1",
      "scope": "固定历史代码或验收资料，用于复查机制及原验证范围。案例中的复检是建议步骤，不代表本轮执行结果。",
      "observed_at": "2026-10-15",
      "reference": "https://github.com/glanderness/BeefTV/blob/e2ae3d549a699ec2d00680d9c9eda844078a75f5/scripts/test-depth-runtime-windows.ps1"
    }
  ],
  "limitations": [
    "原修复只针对构建自检脚本，不能当作客户推理或所有 shell 管道问题已修复。",
    "本轮是历史知识补录，没有在客户机器执行修复，也没有重跑历史付费生成、原生安装或平台矩阵。"
  ]
}
