{
  "schema_version": 1,
  "id": "ENV-0020",
  "title": "Windows 发布包漏装 CLI 使 MCP 错启动桌面主程序",
  "category": "installer",
  "platforms": [
    "windows"
  ],
  "products": [
    "BeefTV"
  ],
  "keywords": [
    "MCP",
    "cli/beeftv.exe",
    "桌面窗口",
    "握手超时"
  ],
  "status": "confirmed",
  "updated_at": "2026-10-15",
  "summary": "外部 MCP 客户端启动后弹出 BeefTV 窗口并等待握手超时。 案例收录已确认的具体机制；发布与客户恢复另看证据。",
  "symptoms": [
    "外部 MCP 客户端启动后弹出 BeefTV 窗口并等待握手超时。"
  ],
  "environment": [
    "Windows 发布包缺 cli/beeftv.exe，接入配置回退到同名 GUI 程序。"
  ],
  "cause": {
    "summary": "缺失命令行入口没有明确失败，GUI 程序被当成 stdio 协议进程。",
    "confidence": "confirmed",
    "evidence_ids": [
      "E1",
      "E2"
    ]
  },
  "detection": {
    "checks": [
      "对最终归档内 CLI 执行 initialize/tools/list，而不是开发目录二进制。",
      "检查配置命令指向随包 CLI 以及明确工作区，GUI 入口应拒绝 MCP 参数。"
    ],
    "exclusions": [
      "仅当所列环境与检查结果吻合时适用；相同症状仍需排除其他原因。"
    ]
  },
  "remediations": [
    {
      "kind": "product_fix",
      "description": "补齐发布包 CLI，缺失时停止签发接入配置；桌面与 CLI 入口明确分开。",
      "steps": [
        "补齐发布包 CLI，缺失时停止签发接入配置；桌面与 CLI 入口明确分开。"
      ],
      "verification": [
        "最终 ZIP 的 CLI 可握手和退出；缺 CLI 的包被门禁拒绝，不再启动 GUI 兜底。"
      ],
      "risks": [
        "不把 GUI 启动成功、进程存活或 stdout 混有日志当作 MCP 握手成功。"
      ],
      "evidence_ids": [
        "E1",
        "E2"
      ]
    }
  ],
  "evidence": [
    {
      "id": "E1",
      "type": "source_analysis",
      "summary": "历史已合并 PR #70 对机制和处理的记录：缺失命令行入口没有明确失败，GUI 程序被当成 stdio 协议进程。",
      "scope": "本轮回读 PR 合并状态，并核对固定提交所列代码/验收记录；历史验证不记为本轮重跑，不据此认定客户已恢复。",
      "observed_at": "2026-10-15",
      "reference": "https://github.com/glanderness/BeefTV/pull/70"
    },
    {
      "id": "E2",
      "type": "source_analysis",
      "summary": "固定提交 6be3a1323f2a90390aeeab42cf1bebfff94bcee5：backend/cmd/desktop/command_guard.go",
      "scope": "固定历史代码或验收资料，用于复查机制及原验证范围。案例中的复检是建议步骤，不代表本轮执行结果。",
      "observed_at": "2026-10-15",
      "reference": "https://github.com/glanderness/BeefTV/blob/6be3a1323f2a90390aeeab42cf1bebfff94bcee5/backend/cmd/desktop/command_guard.go"
    }
  ],
  "limitations": [
    "最终包握手不代表每个第三方 MCP 客户端与付费业务都已实测。",
    "本轮是历史知识补录，没有在客户机器执行修复，也没有重跑历史付费生成、原生安装或平台矩阵。"
  ]
}
