{
  "schema_version": 1,
  "id": "ENV-0029",
  "title": "远端视频取帧的凭据策略与解码能力不匹配",
  "category": "media",
  "platforms": [
    "windows",
    "macos"
  ],
  "products": [
    "BeefTV"
  ],
  "keywords": [
    "CORS",
    "credentials",
    "HEVC",
    "关键帧",
    "H.264"
  ],
  "status": "confirmed",
  "updated_at": "2026-10-15",
  "summary": "远端或资源视频可见，但截取关键帧无结果；原片解码失败后直接退出。 案例收录已确认的具体机制；发布与客户恢复另看证据。",
  "symptoms": [
    "远端或资源视频可见，但截取关键帧无结果；原片解码失败后直接退出。"
  ],
  "environment": [
    "同源受控资源、跨源 CDN 与 HEVC 原片需要不同鉴权和播放处理。"
  ],
  "cause": {
    "summary": "取帧路径未完整解析受控资源和凭据策略，原片解码失败又没有沿用可用的 H.264 播放副本。",
    "confidence": "confirmed",
    "evidence_ids": [
      "E1",
      "E2"
    ]
  },
  "detection": {
    "checks": [
      "区分资源 URL 与跨源 CDN，检查请求携带凭据及 CORS 响应。",
      "确认 resourceId 归属、原片解码结果和兼容副本可读性；尾帧时间计算异常需另查。"
    ],
    "exclusions": [
      "仅当所列环境与检查结果吻合时适用；相同症状仍需排除其他原因。"
    ]
  },
  "remediations": [
    {
      "kind": "product_fix",
      "description": "按资源类型选择凭据，解析受控资源；原片失败且有资源身份时取兼容播放副本再试。",
      "steps": [
        "按资源类型选择凭据，解析受控资源；原片失败且有资源身份时取兼容播放副本再试。"
      ],
      "verification": [
        "同源受控资源仍可鉴权，跨源 URL 不附带多余凭据；兼容副本能完成取帧，原文件保留。"
      ],
      "risks": [
        "不得全局携带 Cookie、放宽跨源权限或把凭据发给第三方 CDN。"
      ],
      "evidence_ids": [
        "E1",
        "E2"
      ]
    }
  ],
  "evidence": [
    {
      "id": "E1",
      "type": "source_analysis",
      "summary": "历史已合并 PR #153 对机制和处理的记录：取帧路径未完整解析受控资源和凭据策略，原片解码失败又没有沿用可用的 H.264 播放副本。",
      "scope": "本轮回读 PR 合并状态，并核对固定提交所列代码/验收记录；历史验证不记为本轮重跑，不据此认定客户已恢复。",
      "observed_at": "2026-10-15",
      "reference": "https://github.com/glanderness/BeefTV/pull/153"
    },
    {
      "id": "E2",
      "type": "source_analysis",
      "summary": "固定提交 4b9090e05a41a4d26d787243a09ed09cd8f12066：web/src/lib/canvas/canvas-video-frame.ts",
      "scope": "固定历史代码或验收资料，用于复查机制及原验证范围。案例中的复检是建议步骤，不代表本轮执行结果。",
      "observed_at": "2026-10-15",
      "reference": "https://github.com/glanderness/BeefTV/blob/4b9090e05a41a4d26d787243a09ed09cd8f12066/web/src/lib/canvas/canvas-video-frame.ts"
    }
  ],
  "limitations": [
    "PR 的相邻尾帧时间修复属于时间计算问题，不能作为本案例网络/解码根因；本轮未运行原生视频。",
    "本轮是历史知识补录，没有在客户机器执行修复，也没有重跑历史付费生成、原生安装或平台矩阵。"
  ]
}
