{
  "schema_version": 1,
  "id": "ENV-0006",
  "title": "运行中的临时文件阻止整个存储目录迁移",
  "category": "storage",
  "platforms": [
    "windows"
  ],
  "products": [
    "BeefTV"
  ],
  "keywords": [
    "cache/tmp",
    "文件占用",
    "迁移",
    "CleanupPrevious"
  ],
  "status": "confirmed",
  "updated_at": "2026-10-15",
  "summary": "应用运行时迁移存储目录失败；迁移后清理旧目录可能反复提示占用。 案例收录已确认的具体机制；发布与客户恢复另看证据。",
  "symptoms": [
    "应用运行时迁移存储目录失败；迁移后清理旧目录可能反复提示占用。"
  ],
  "environment": [
    "Windows 临时目录 cache/tmp 中有活动进程持有句柄；持久项目、素材和其他缓存仍需迁移。"
  ],
  "cause": {
    "summary": "旧逻辑把可丢弃的自有临时目录纳入空间估算、快照、复制和校验；清理顺序也可能先删除持久副本再遇到临时文件锁。",
    "confidence": "confirmed",
    "evidence_ids": [
      "E1",
      "E2"
    ]
  },
  "detection": {
    "checks": [
      "从错误阶段确定占用对象是否严格位于自有 cache/tmp。",
      "用真实排他句柄分别锁住临时文件和素材，验证两类情况不能混为一谈。"
    ],
    "exclusions": [
      "仅当所列环境与检查结果吻合时适用；相同症状仍需排除其他原因。"
    ]
  },
  "remediations": [
    {
      "kind": "product_fix",
      "description": "仅排除自有临时目录；清理旧目录先处理临时文件，失败保留持久副本和清理记录，释放后再试。",
      "steps": [
        "仅排除自有临时目录；清理旧目录先处理临时文件，失败保留持久副本和清理记录，释放后再试。"
      ],
      "verification": [
        "临时文件被占用时迁移可完成；素材被占用时安全停止；清理失败后原副本和重试记录仍在。"
      ],
      "risks": [
        "不能按 .tmp 后缀或 cache 名称批量跳过数据；其他缓存及目录外临时命名文件仍需完整迁移。"
      ],
      "evidence_ids": [
        "E1",
        "E2"
      ]
    }
  ],
  "evidence": [
    {
      "id": "E1",
      "type": "source_analysis",
      "summary": "历史已合并 PR #126 对机制和处理的记录：旧逻辑把可丢弃的自有临时目录纳入空间估算、快照、复制和校验；清理顺序也可能先删除持久副本再遇到临时文件锁。",
      "scope": "本轮回读 PR 合并状态，并核对固定提交所列代码/验收记录；历史验证不记为本轮重跑，不据此认定客户已恢复。",
      "observed_at": "2026-10-15",
      "reference": "https://github.com/glanderness/BeefTV/pull/126"
    },
    {
      "id": "E2",
      "type": "source_analysis",
      "summary": "固定提交 dbf117bab55a937c8b6382d009152ec166c7439e：backend/internal/desktopstorage/files.go",
      "scope": "固定历史代码或验收资料，用于复查机制及原验证范围。案例中的复检是建议步骤，不代表本轮执行结果。",
      "observed_at": "2026-10-15",
      "reference": "https://github.com/glanderness/BeefTV/blob/dbf117bab55a937c8b6382d009152ec166c7439e/backend/internal/desktopstorage/files.go"
    }
  ],
  "limitations": [
    "Unix 权限失败是另一原因，不能自动提示为文件占用；历史 Windows 回归不等于每个现场已恢复。",
    "本轮是历史知识补录，没有在客户机器执行修复，也没有重跑历史付费生成、原生安装或平台矩阵。"
  ]
}
