{
  "schema_version": 1,
  "id": "ENV-0031",
  "title": "续传重置缓存失败后旧字节与新标识混用",
  "category": "storage",
  "platforms": [
    "windows",
    "macos",
    "linux"
  ],
  "products": [
    "BeefTV"
  ],
  "keywords": [
    "partial",
    "ETag",
    "文件权限",
    "truncate",
    "续传缓存"
  ],
  "status": "confirmed",
  "updated_at": "2026-10-15",
  "summary": "续传遇到文件访问失败，后续重试可能返回成功但文件字节拼接错误。 案例收录已确认的具体机制；发布与客户恢复另看证据。",
  "symptoms": [
    "续传遇到文件访问失败，后续重试可能返回成功但文件字节拼接错误。"
  ],
  "environment": [
    "已有 partial 和 sidecar；服务器要求完整重下，同时本地打开或截断缓存失败。"
  ],
  "cause": {
    "summary": "旧顺序先写新 sidecar，再尝试清空旧 partial；失败后缓存头仍是旧版本而标识已变成新版本。",
    "confidence": "confirmed",
    "evidence_ids": [
      "E1",
      "E2"
    ]
  },
  "detection": {
    "checks": [
      "用受控文件打开/截断失败，比较 partial 字节与 sidecar 对应对象。",
      "核对失败前是否已经丢弃旧缓存，以及重试是否错误追加。"
    ],
    "exclusions": [
      "仅当所列环境与检查结果吻合时适用；相同症状仍需排除其他原因。"
    ]
  },
  "remediations": [
    {
      "kind": "product_fix",
      "description": "成功打开、清空并定位文件后再提交对应续传信息；metadata 写入失败停止读取响应。",
      "steps": [
        "成功打开、清空并定位文件后再提交对应续传信息；metadata 写入失败停止读取响应。"
      ],
      "verification": [
        "注入文件故障后不会混合版本；恢复权限后得到完整哈希一致的单一对象。"
      ],
      "risks": [
        "先保留可恢复旧字节；不能吞掉 open/truncate/sidecar 错误后继续读取。"
      ],
      "evidence_ids": [
        "E1",
        "E2"
      ]
    }
  ],
  "evidence": [
    {
      "id": "E1",
      "type": "source_analysis",
      "summary": "历史已合并 PR #154 对机制和处理的记录：旧顺序先写新 sidecar，再尝试清空旧 partial；失败后缓存头仍是旧版本而标识已变成新版本。",
      "scope": "本轮回读 PR 合并状态，并核对固定提交所列代码/验收记录；历史验证不记为本轮重跑，不据此认定客户已恢复。",
      "observed_at": "2026-10-15",
      "reference": "https://github.com/glanderness/BeefTV/pull/154"
    },
    {
      "id": "E2",
      "type": "source_analysis",
      "summary": "固定提交 263c91a0aa9cce638b895f3345ebe9abdc7340e4：backend/internal/outbound/resumable.go",
      "scope": "固定历史代码或验收资料，用于复查机制及原验证范围。案例中的复检是建议步骤，不代表本轮执行结果。",
      "observed_at": "2026-10-15",
      "reference": "https://github.com/glanderness/BeefTV/blob/263c91a0aa9cce638b895f3345ebe9abdc7340e4/backend/internal/outbound/resumable.go"
    }
  ],
  "limitations": [
    "属于文件故障下的下载一致性；磁盘损坏和任意客户端缓存格式不在历史验证范围。",
    "本轮是历史知识补录，没有在客户机器执行修复，也没有重跑历史付费生成、原生安装或平台矩阵。"
  ]
}
