{
  "schema_version": 1,
  "id": "ENV-0012",
  "title": "PowerShell 生成的 ZIP 使用反斜杠条目被解压器拒绝",
  "category": "installer",
  "platforms": [
    "windows"
  ],
  "products": [
    "BeefTV"
  ],
  "keywords": [
    "ZIP",
    "PowerShell 5.1",
    "反斜杠",
    "路径校验"
  ],
  "status": "confirmed",
  "updated_at": "2026-10-15",
  "summary": "签名组件下载成功，但解压时提示压缩包包含非安全路径。 案例收录已确认的具体机制；发布与客户恢复另看证据。",
  "symptoms": [
    "签名组件下载成功，但解压时提示压缩包包含非安全路径。"
  ],
  "environment": [
    "PowerShell 5.1/.NET Framework 创建 ZIP，条目分隔符为 Windows 反斜杠；消费方要求可移植路径。"
  ],
  "cause": {
    "summary": "解压器把所有反斜杠当成恶意路径，拒绝合法组件；直接放宽又可能允许路径穿越。",
    "confidence": "confirmed",
    "evidence_ids": [
      "E1",
      "E2"
    ]
  },
  "detection": {
    "checks": [
      "只读列出 ZIP 条目，检查是否为正常相对路径的反斜杠形式。",
      "归一化后重新检查绝对路径、盘符、..、符号链接和重复条目，不能跳过校验。"
    ],
    "exclusions": [
      "仅当所列环境与检查结果吻合时适用；相同症状仍需排除其他原因。"
    ]
  },
  "remediations": [
    {
      "kind": "product_fix",
      "description": "先统一分隔符，再执行包含关系、签名体积、哈希及文件安全检查。",
      "steps": [
        "先统一分隔符，再执行包含关系、签名体积、哈希及文件安全检查。"
      ],
      "verification": [
        "合法 Windows 分隔符包可解压；混合分隔符穿越、盘符和绝对路径仍拒绝。"
      ],
      "risks": [
        "禁止整体移除 ZIP 路径安全检查；不要在用户数据目录直接试解未知包。"
      ],
      "evidence_ids": [
        "E1",
        "E2"
      ]
    }
  ],
  "evidence": [
    {
      "id": "E1",
      "type": "source_analysis",
      "summary": "历史已合并 PR #47 对机制和处理的记录：解压器把所有反斜杠当成恶意路径，拒绝合法组件；直接放宽又可能允许路径穿越。",
      "scope": "本轮回读 PR 合并状态，并核对固定提交所列代码/验收记录；历史验证不记为本轮重跑，不据此认定客户已恢复。",
      "observed_at": "2026-10-15",
      "reference": "https://github.com/glanderness/BeefTV/pull/47"
    },
    {
      "id": "E2",
      "type": "source_analysis",
      "summary": "固定提交 69fbf9bc6f3c422ebe91c9dbf8034c90ffe9e46f：backend/internal/depthruntime/installer.go",
      "scope": "固定历史代码或验收资料，用于复查机制及原验证范围。案例中的复检是建议步骤，不代表本轮执行结果。",
      "observed_at": "2026-10-15",
      "reference": "https://github.com/glanderness/BeefTV/blob/69fbf9bc6f3c422ebe91c9dbf8034c90ffe9e46f/backend/internal/depthruntime/installer.go"
    }
  ],
  "limitations": [
    "本案例只解释条目路径表示，不解释下载字节损坏、签名不匹配和模型推理异常。",
    "本轮是历史知识补录，没有在客户机器执行修复，也没有重跑历史付费生成、原生安装或平台矩阵。"
  ]
}
